Agency/Brokerage Name,Town/City,Approx Distance from Bolton (mi),Website,Phone,Broker/Owner Name,Approx # of Agents,Notable Details
RE/MAX Traditions,"Bolton, MA",0,https://www.remax.com/real-estate-offices/remax-traditions-bolton-ma/100427756,(978) 779-5234,Eileen Fitzpatrick (Broker/Owner),5-10,"Independent RE/MAX franchise in Bolton since 1999; Eileen licensed since 1987; small local office"
Kotlarz Realty Group (Keller Williams),"Bolton, MA",0,https://www.kotlarzrealtygroup.com/,(978) 502-5862,Deborah Kotlarz,5-10,"Top team under KW Boston Northwest; #1 realtor per Worcester Business Journal; serves Bolton/Stow/Hudson/Concord area; buyer/seller agent specialization"
Hazel & Company Real Estate,"Harvard, MA",5,https://www.hazelre.com/,(978) 456-3307,Nancy Hazel (Broker),3-5,"Oldest real estate company in Harvard/Bolton area since 1947; intentionally small for personalized service; ideal independent target"
Renzi Real Estate,"Lancaster, MA",6,https://www.renzirealestate.net/,(978) 870-7867,Clayton Renzi,1-3,"Small independent brokerage; serves Lancaster/Sterling/Clinton/Bolton; very small operation - ideal for AI consulting"
Century 21 Center Home Team,"Sterling, MA",8,https://www.c21cht.com/,(978) 422-9800,,10-15,"Franchise office at same location since 1987 (formerly Sterling Centre Realty); serves Sterling/Lancaster/Princeton/Clinton/Berlin"
Karen Packard Real Estate,"Sterling, MA",8,https://www.karenpackard.com/,(978) 407-2568,Karen Packard (Broker),1-3,"Small independent; top agent in North Worcester County 10+ years; serves Sterling/West Boylston/Bolton/Lancaster"
Open Door Real Estate,"Sterling, MA",8,https://www.opendoor-re.com/,(978) 422-5252,Lauren Demerjian (Broker/Owner),6-10,"Full-service independent brokerage; multiple agents; serves Sterling/Princeton area"
The Attias Group,"Concord, MA",10,https://www.theattiasgroup.com/,(978) 371-1234,Zur Attias (CEO/Broker),8-12,"Locally-owned; top 1/2 of 1% of 27,000+ MA realtors; high-performing independent team"
Barrett Sotheby's International Realty,"Concord, MA",10,https://barrettsothebysrealty.com/,(978) 369-6453,Laurie Cadigan (President),40-60,"Independently owned since 1977; offices in Concord/Acton/Bedford/Lexington; luxury market; one of most successful independent firms in MA"
Coldwell Banker Realty - Concord,"Concord, MA",10,https://www.coldwellbankerhomes.com/ma/concord/office/concord/oid_3830/,(978) 369-1000,,20-30,"National franchise; large Concord/Carlisle office at 11 Main St; strong brand presence"
Compass - Concord Office,"Concord, MA",10,https://www.compass.com/agents/offices/97-lowell-road-concord-ma-01742/,,38 (Concord office),"Tech-forward national brokerage; 38 agents in Concord office alone; 60 agents serving Concord total"
RE/MAX Culture,"Hudson, MA",8,https://www.remaxculturema.com,(978) 333-4433,Luxan Zayas (Broker/Owner),5-10,"Multi-lingual office (English/Spanish/Portuguese/Korean); covers MetroWest and Central MA; diverse market focus"
RE/MAX Executive Realty - Westborough,"Westborough, MA",14,https://executive-realty-downtown-westborough-ma.remax.com/,(508) 366-0008,,155+,"Largest RE/MAX franchise in New England; 155+ agents; major regional player"
Anthony Joseph Real Estate,"Westborough, MA",14,https://www.anthonyjosephre.com/,(508) 589-6262,Anthony (Tony) Mallozzi (Broker/Owner),3-5,"Family-owned boutique brokerage; BBB A+ rated; specializes in residential Central and MetroWest MA; ideal independent target"
ERA Key Realty Services - Marlborough,"Marlborough, MA",10,https://www.keyrealtyservices.com/marlborough-office/,(508) 303-3434,,15-25 (Marlborough office),"Family-owned company; 15 offices total; 350+ agents company-wide; strong regional presence"
Tunnera Real Estate,"Marlborough, MA",10,https://tunnerarealestate.com,(508) 414-0838,Robert Tunnera (Broker/Owner),1-3,"Small independent brokerage; residential + property management; serves Marlborough/Hudson/Northborough; ideal for AI consulting"
Lamacchia Realty - Northborough,"Northborough, MA",10,https://www.lamacchiarealty.com/northborough-office/,(508) 290-0303,Anthony Lamacchia (Owner),400+ (company-wide),"Fast-growing regional brokerage; 400+ agents across MA/NH/CT/RI/FL; tech-savvy; actively acquiring firms"
LAER Realty Partners - Northborough,"Northborough, MA",10,https://www.laerrealty.com/offices/976-northborough-ma,(508) 936-1062,Kim & Peter McDonald (Broker/Owners since 1986),10-20,"Independent regional brokerage; also has Leominster office; long-established"
LAER Realty Partners - Leominster,"Leominster, MA",15,https://www.laerrealty.com/offices/972-leominster-ma,(978) 534-3100,Kim & Peter McDonald (Broker/Owners),10-20,"Second office of LAER Realty; serves North Central MA"
Foster-Healey Real Estate,"Leominster, MA",15,https://www.foster-healey.com/,(978) 537-8301,Rick Healey (President),50,"Independent since 1924; 100+ years in business; 50 agents; offices in Leominster/Athol/Gardner; flagship 6,500 sq ft building; strong independent target"
Mary Foley Real Estate,"Leominster, MA",15,https://www.maryfoleyrealestate.com/,(978) 840-3030,Mary Foley (Owner),3-5,"Independent; established 2006; 24+ years experience; residential/commercial/investment; small office"
Keller Williams Realty North Central,"Leominster, MA",15,https://northcentral.yourkwoffice.com/,(978) 840-9000,,139,"Major KW franchise; 139 active agents; $375M+ sales volume; serves central MA/Metro Boston suburbs"
EXIT New Options Real Estate,"Leominster, MA",15,https://www.exitnewoptions.com/,(978) 345-3948,,5-10,"Locally owned and independently operated; small office; personalized service focus"
Real Estate Exchange,"Leominster/Fitchburg, MA",15-20,https://ree123.com/,(978) 582-4339,,3-5,"Independent; serves Fitchburg/Groton/Harvard/Leominster/Littleton/Lunenburg area; both buyers and sellers"
Coldwell Banker Realty - Sudbury,"Sudbury, MA",12,https://www.coldwellbankerhomes.com/ma/sudbury/office/wayland-sudbury-regional-office/oid_3909/,(978) 443-9933,,20-30,"National franchise; Wayland-Sudbury Regional Office; 447 Boston Post Rd"
Compass - Sudbury,"Sudbury, MA",12,https://www.compass.com/agents/locations/sudbury-ma/20588/,,29,"Tech-forward national brokerage; 29 agents serving Sudbury"
Barrett Sotheby's International Realty - Acton,"Acton, MA",10,https://www.sothebysrealty.com/eng/office/180-b-84411-4001587/barrett-sothebys-international-realty,+1 (978) 263-1166,,10-20,"Branch office of Barrett Sotheby's; independently owned; luxury focus; 525 Massachusetts Ave #105"
RE/MAX Vision,"Shrewsbury, MA",18,https://www.remax.com/real-estate-offices/remax-vision-shrewsbury-ma/100428126,(508) 842-3000,,10-15,"RE/MAX franchise; 181 Main Street; serves Shrewsbury/Worcester/surrounding towns"
BA Property & Lifestyle Advisors,"Worcester, MA",22,https://www.bapropertylifestyle.com/,(508) 905-6073,Mike Barbera (Owner/Broker),5-10,"Independent; established 1999; also runs commercial brokerage (Rubric); serves all MA"
Quinsigamond Realty,"Worcester, MA",22,https://www.quinsigrealty.com/,(508) 798-2020,Michael Madulka (Owner),3-5,"Independent; est. 2009; 80+ years combined experience; residential focus; small office"
Properties Central Realty,"Worcester, MA",22,https://propertiescentralrealty.com/,(508) 499-7600,Joe Abbascia (Broker),3-5,"Independent; 1-4 unit residential specialist; 100+ years combined team experience; 1180 Main St"
A-1 Realty of MA,"Worcester, MA",22,https://a1realtyofma.com/,(508) 868-4662,Duane Papetti (Broker/Owner),3-5,"Independent; est. 2010; expanded statewide 2024; investment property expertise; serves Worcester/Shrewsbury/Sterling/Lancaster"
Better Living Real Estate,"Worcester/Central MA",22,https://www.betterlivingre.net/,,,"Boston Globe Top Places to Work 2023 & 2024; 38+ years experience; licensed in MA/NH/RI; growing fast"
Chinatti Realty Group,"Chelmsford, MA (serves Bolton area)",20,https://www.chinattirealty.com/,,Lisa Chinatti (Founder),20-30,"Female-owned; 3,000+ homes sold; 660+ 5-star reviews; serves all Greater Boston including Bolton"
